source_portal,city_slug,operation,page_number,listing_id,listing_key,listing_url,contact_url,card_title,detail_title,product_name,listing_type,advertiser_type,price_eur,price_per_m2_eur,area_m2,bathroom_count,tag_list,description_short,description_full,breadcrumb_zone,breadcrumb_path,address_text,geocode_query,geocode_status,coord_source,coord_precision,geocode_display_name,lat_wgs84,lon_wgs84,h3_cell,h3_resolution,section_key,district_code,district_name,barrio_code,barrio_name,published_at,modified_at,detail_fetch_status
locales.es,madrid,venta,7,141238,venta:141238,https://www.locales.es/madrid/venta/local141238?offerType=1&estateType=3&settlement=6773,https://www.locales.es/madrid/contactar/propietario/141238,"Local comercial en Venta en Calle Los Chulapos, Imperial, Madrid","Local comercial en venta con 73m² en Madrid, en la zona de Imperial, Calle Los Chulapos",Local comercial,local_comercial,De inmobiliaria,617000.0,8452.1,73.0,2.0,Cocina completamente equipada,"73 m²; planta calle + sótano; aseo, cocina y cámara; salida de humos en proceso; posibilidad de terraza previa licencia.","4304. REF-4304- UNIONSOL OFRECE LOCAL DE HOSTELERIA EN VENTA EN EL CENTRO DE MADRID VALOR DE LA VENTA / 617.000 €- Se trata de local comercial apto para la hostelería en la zona de la Latina con Sala de ventas en planta calle y sótano. con aseo, cocina y cámara.• Salida de Humos: en proceso de adecuación.• Dispone de posibilidad de terraza tras solicitud de licencia.Unionsol genera las mejores oportunidades para conseguir su propio negocio, presentando alternativas seleccionadas en hostelería y muchos otros tipos de actividades comercialesNota: la documentación presentada por Unionsol queda a total responsabilidad la verificación de la misma por parte del comprador, clienteLos precios anotados en este formato son + IVA.",Imperial,Madrid > Imperial > Venta,"Calle Los Chulapos, Imperial, Madrid","Imperial, Madrid, España",ok,nominatim,zone_approx,"Imperial, Arganzuela, Madrid, Comunidad de Madrid, España",40.4057995,-3.7186854,,,,,,,,2025-10-17T00:44:39+0000,2025-10-17T00:44:39+0000,ok
locales.es,madrid,venta,7,142685,venta:142685,https://www.locales.es/madrid/venta/local142685?offerType=1&estateType=3&settlement=6773,https://www.locales.es/madrid/contactar/propietario/142685,"Local comercial en Venta en avenida de alberto alcocer, Hispanoamérica, Madrid","Local comercial en venta con 220m² en Madrid, en la zona de Hispanoamérica, avenida de alberto alcocer, 28036",Local comercial,local_comercial,De inmobiliaria,1800000.0,8181.8,220.0,3.0,Aire acondicionado | Montacargas | Ascensor | Escaparate | +1,"220 m² (200 útiles) en 2 plantas (125+75 m²). Montacargas y ascensor, zona diáfana, 2 despachos, cocina, 3 baños. Apto eventos/showroom; no hostelería.","105773/EV. El Viso Inmobiliaria ofrece magnifico local de unos 220 m2c. (unos 200 útiles) en la Avda, Alberto Alcocer. De diseño y muy luminoso con amplio escaparate, en 2 plantas, 125 m2 en planta calle y 75 en planta alta conectadas por escalera y montacargas, con la siguiente distribución:Abajo: vestíbulo, gran zona diáfana con gran altura de techos (unos 5 m), 2 amplios despachos y cocina/office. Arriba: sala diáfana, cuarto maquinas, 3 cuartos de baño, almacén.Reciente reforma integral con calidades de lujo: climatización, suelos, iluminación leed, elevador para hacer accesible la 1ª planta.Muy comercial, actualmente destinado a Eventos, show-room, apto para cualquier actividad, salvo hostelería con salida de humos. Ideal inversionistas, con una buena rentabilidad.Magnífica ubicación en el distrito de Chamartín, cerca del Santiago Bernabéu, una de las zonas residenciales más exclusivas de Madrid, con todo tipo de servicios y dotaciones (Colegios, Mercados, Supermercados, Hospitales, Hoteles y una amplia variedad de opciones de ocio).Muy bien comunicada, por Metro, varias líneas de Autobuses, la Estación de Chamartín (trenes de Media, Larga Distancia, Alta Velocidad y Cercanías) y con fácil acceso a la M-30, M-40 y al Aeropuerto. \""El Viso Inmobiliaria ofrece inmuebles en alquiler y en venta en las zonas más exclusivas de Madrid..",Hispanoamérica,Madrid > Hispanoamérica > Venta,"avenida de alberto alcocer, Hispanoamérica, Madrid","avenida de alberto alcocer, Hispanoamérica, Madrid, España",ok,nominatim,street_approx,"Avenida de Alberto Alcocer, Hispanoamérica, Chamartín, Madrid, Comunidad de Madrid, 28046, España",40.4587073,-3.6850076,8a390cb0a46ffff,10.0,5067.0,5.0,Chamartín,54.0,Hispanoamérica,2025-10-27T18:42:11+0000,2025-10-27T18:42:12+0000,ok
locales.es,madrid,venta,7,142897,venta:142897,https://www.locales.es/madrid/venta/local142897?offerType=1&estateType=3&settlement=6773,https://www.locales.es/madrid/contactar/propietario/142897,"Local comercial en Venta en San Isidro, Madrid","Local comercial en venta con 286m² en Madrid, en la zona de San Isidro",Local comercial,local_comercial,De inmobiliaria,329900.0,1153.5,286.0,2.0,,"Local de 286 m² en Madrid, 2 baños, amplios espacios abiertos, apto para diversos usos comerciales, cercano a servicios y alta afluencia peatonal.","!Oportunidad única en el corazón de Madrid! Este local comercial en venta cuenta con una ubicación privilegiada y un gran potencial para ser transformado en el negocio de tus sueños. Con 2 baños y amplios espacios abiertos, ofrece una versatilidad para adaptarse a cualquier tipo de actividad comercial. Situado en una zona de gran afluencia de público y rodeado de todo tipo de servicios, es ideal para emprender un nuevo proyecto o expandir tu negocio. !No pierdas la oportunidad de adquirir este local ! Nota informativa: La venta se produce sin cargas. El precio indicado no incluye impuestos ni gastos. La compraventa está sujeta a IVA tipo 21%. El comprador deberá asumir los gastos derivados de la escritura pública de compraventa en notaría, la inscripción en el Registro de la Propiedad y, en su caso, los honorarios de gestoría si decide contratarla. En caso de financiación hipotecaria, se firmará una escritura de préstamo hipotecario cuyos gastos serán los establecidos por la normativa vigente y la entidad financiera correspondiente le comunique .",San Isidro,Madrid > San Isidro > Venta,"San Isidro, Madrid","San Isidro, Madrid, España",ok,nominatim,zone_approx,"San Isidro, Carabanchel, Madrid, Comunidad de Madrid, España",40.3970503,-3.7293542,,,,,,,,2025-10-29T08:20:55+0000,2025-10-29T08:20:56+0000,ok
locales.es,madrid,venta,7,144071,venta:144071,https://www.locales.es/madrid/venta/local144071?offerType=1&estateType=3&settlement=6773,https://www.locales.es/madrid/contactar/propietario/144071,Local comercial en Venta en Madrid,Local comercial en venta con 141m² en Madrid,Local comercial,local_comercial,De inmobiliaria,539500.0,3826.2,141.0,4.0,Salida de humos,"141 m² en Paseo Tierra de Melide. Fachada Suroeste, luminoso; planta a pie de calle sin barreras; salida de humos; apto para restauración.","28-327-1424. En venta local de 141 m2 en Paseo Tierra de Melide, una de las calles con mayor actividad comercial de Las Tablas. El local cuenta con una gran fachada con orientación Suroeste lo que le otorga mucha luminosidad y visibilidad, tiene una planta muy cuadrada lo que facilita el correcto aprovechamiento de la superficie y dispone de salida de humos hasta la cubierta del edificio lo que le hace ideal para destinarlo a restauración, aunque por supuesto es apto para cualquier actividad comercial al discurrir todo el local en una sola planta a pie de calle, sin ningún tipo de barrera arquitectónica. Una excelente oportunidad para adquirir un local en una de las zonas de Madrid con mayor proyección económica gracias al desarrollo inminente de Nuevo Madrid Norte. Gastos comunidad 170€; IBI 1.003€. SE RECOMIENDA VER LOS DOS VIDEOS DEL EXTERIOR E INTERIOR DEL LOCAL SUBIDOS AL ANUNCIO. Llámenos, estaremos encantados de informarle sin compromiso. Honorarios de agencia por cuenta de la PROPIEDAD..",,Madrid > Venta,Madrid,"Madrid, España",ok,nominatim,unknown,"Madrid, Comunidad de Madrid, España",40.416782,-3.703507,,,,,,,,2025-11-10T15:42:36+0000,2025-11-10T15:42:36+0000,ok
locales.es,madrid,venta,7,144466,venta:144466,https://www.locales.es/madrid/venta/local144466?offerType=1&estateType=3&settlement=6773,https://www.locales.es/madrid/contactar/propietario/144466,"Local comercial en Venta en Avenida del Monte Igueldo, San Diego, Madrid","Local comercial en venta con 128m² en Madrid, en la zona de San Diego, Avenida del Monte Igueldo",Local comercial,local_comercial,De inmobiliaria,180000.0,1406.3,128.0,2.0,Sistemas de Seguridad | Almacén | Situado a pie de calle,"128 m²: 4 estancias, 2 oficinas, 2 baños, almacén 40 m²; fachada 2,72 m con escaparate; puerta de seguridad y alarma.","localavmonte-venta. ¡GRAN OPORTUNIDAD EN PUENTE DE VALLECAS!~Av. del Monte Igueldo, Puente de Vallecas, 28053 Madrid. ¡Ven a verlo! Disponibilidad inmediata y visita virtual en 3D para una mejor experiencia visual. Contacto directo: Emiliano Correa – 602 250 283 (también WhatsApp)~Horario de atención (lunes a viernes):~Mañanas: 09:30 a 14:00~Tardes: 17:00 a 20:00 ¿Buscas un espacio amplio, bien ubicado y listo para emprender tu negocio?~Este local comercial a pie de calle te ofrece visibilidad, amplitud y versatilidad, en una zona con alto tránsito y excelente proyección comercial.~Zona en plena transformación urbana y con gran proyección. Puente de Vallecas está viviendo una renovación que combina nuevos proyectos residenciales, mejora de infraestructuras y llegada de nuevos negocios. Una oportunidad para invertir en un entorno que crece y se revaloriza día a día. Características principales: 128 m² construidos ~Distribución funcional en 4 estancias~2 oficinas, 2 baños y un gran almacén de 40 m²~Fachada de 2,72 m con cortina metálica y escaparate~Puerta de seguridad y sistema de alarma instalados Estado: Listo para entrar / Buen mantenimiento Ideal para:~Supermercado, comercio mayorista, almacén o negocio polirubro. (cualquier otro tipo de proyecto) ~Su distribución práctica y su ubicación lo convierten en una excelente inversión. Ubicación inmejorable:~A tan solo 8 minutos del Metro Nueva Numancia, rodeado de colegios, centros de salud y múltiples comercios, en una zona con gran movimiento y fácil acceso..",San Diego,Madrid > San Diego > Venta,"Avenida del Monte Igueldo, San Diego, Madrid","Avenida del Monte Igueldo, San Diego, Madrid, España",ok,nominatim,street_approx,"Avenida del Monte Igueldo, San Diego, Puente de Vallecas, Madrid, Comunidad de Madrid, 28053, España",40.3925706,-3.6700652,8a390ca31817fff,10.0,13046.0,13.0,Puente de Vallecas,132.0,San Diego,2025-11-11T18:41:20+0000,2025-11-11T18:41:21+0000,ok
locales.es,madrid,venta,7,145689,venta:145689,https://www.locales.es/madrid/venta/local145689?offerType=1&estateType=3&settlement=6773,https://www.locales.es/madrid/contactar/propietario/145689,"Local comercial en Venta en Calle del Rincón de la Victoria, Palomeras Sureste, Madrid","Local comercial en venta con 51m² en Madrid, en la zona de Palomeras Sureste, Calle del Rincón de la Victoria",Local comercial,local_comercial,De inmobiliaria,172000.0,3372.5,51.0,,Almacén,"Local ~50 m² con trastero y distribución eficiente. Adaptable a diferentes negocios. En Palomeras Sureste, cerca de metro, autobuses y tren.","7400. OH! KEY Servicios Inmobiliarios, VENDE por jubilación un magnífico local comercial, actualmente en funcionamiento con actividad de fruteríaUbicado zona de Palomeras Sureste, Madrid. Con 50 metros cuadrados útiles, este local ofrece la versatilidad necesaria para adaptarse a diversas actividades comerciales.El local presenta una distribución eficiente, lo que maximiza el uso del espacio. Además, dispone de un práctico trastero o espacio, perfecto para el almacenamiento de mercancías o para satisfacer cualquier otra necesidad logística que requiera su negocio.Una de las mayores ventajas de esta propiedad es su extraordinaria ubicación en Madrid. Es un lugar estratégico para aquellos que buscan estar en el corazón de una comunidad vibrante. A escasos minutos se encuentran varias líneas de autobuses con frecuencias regulares, facilitando el acceso a todas las áreas de la ciudad. Además, la proximidad a la red de metro es otro atractivo indudable. La estación más cercana se encuentra a solo unos pasos, conectando rápidamente con el centro de Madrid y otras zonas estratégicas de la capital. De igual forma, las cercanías ofrecen servicios de tren que amplían aún más las posibilidades de desplazamiento.Otro aspecto que resalta de esta propiedad es su adaptabilidad para diferentes tipos de negocio.Por último, pero no menos importante, el carácter del barrio de Palomeras Sureste brinda una atmósfera única que combina tradición y modernidad, creando un caldo de cultivo óptimo para la innovación comercial. Aquí, cada esquina cuenta una historia y cada iniciativa tiene la oportunidad de brillar con luz propia.En conclusión, esta es una oportunidad inigualable para establecer su actividad comercial en una zona de Madrid que ofrece visibilidad, y comodidad. ¡No dude en contactar con nosotros en el teléfono , donde le atenderemos gustosamente y un asesor especialista en la zona le informará de todo lo necesario. REF 7400.",Palomeras Sureste,Madrid > Palomeras Sureste > Venta,"Calle del Rincón de la Victoria, Palomeras Sureste, Madrid","Palomeras Sureste, Madrid, España",ok,nominatim,zone_approx,"Palomeras Sureste, Puente de Vallecas, Madrid, Comunidad de Madrid, España",40.3861742,-3.6329556,,,,,,,,2025-11-24T23:39:16+0000,2025-11-24T23:39:16+0000,ok
locales.es,madrid,venta,8,110482,venta:110482,https://www.locales.es/madrid/venta/local110482?offerType=1&estateType=3&settlement=6773,https://www.locales.es/madrid/contactar/propietario/110482,"Local comercial en Venta en Calle del Pelícano, Abrantes, Madrid","Local comercial en venta con 115m² en Madrid, en la zona de Abrantes, Calle del Pelícano",Local comercial,local_comercial,De inmobiliaria,329000.0,2860.9,115.0,2.0,Cocina completamente equipada | Muebles | Salida de humos | Barra | +1,"Local de 115m² con salida de humos, ideal para bar y actualmente alquilado, asegurando rentabilidad.","1765523333. ESRIV Inmobiliaria pone a la venta EXCLUSIVO local comercial con SALIDA DE HUMOS en calle del Chimbo a un paso de Camino viejo de Leganés, la calle más comercial de esta zona, donde cada paso encuentras tiendas así como un Mercadona lo cual revaloriza esta exclusiva zona. Este local a pie de calle se encuentra recién REFORMADO con primeras calidades y adaptado para un bar, también se encuentra alquilado, esto hace que puedas sacar una rentabilidad elevada a un bajo coste. A través de su puerta de entrada la cual se encuentra entre los dos escaparates de unos 8 metros en total podrás acceder a la zona del local la cual a mano izquierda verás la barra del bar que divide la zona de trabajo y la demás parte de la estancia principal la cual es super amplia, y te enamorará cada detalle como sus suelos o paredes. Al final de la estancia principal contamos con dos servicios para la clientela y terminando la barra entrarás a la cocina y a otra zona de almacenaje. ~La exclusividad de este local hace que sea ideal para invertir en ella. Hablando de la zona es una de las mejores del sur de Madrid ya que es una zona de mucho tránsito, tiendas y restaurantes lo cual hace ideal para cualquier momento del día..",Abrantes,Madrid > Abrantes > Venta,"Calle del Pelícano, Abrantes, Madrid","Calle del Pelícano, Abrantes, Madrid, España",ok,nominatim,street_approx,"Calle del Pelícano, Abrantes, Carabanchel, Madrid, Comunidad de Madrid, 28025, España",40.3836253,-3.7270807,8a390ca368a7fff,10.0,11173.0,11.0,Carabanchel,117.0,Abrantes,2025-03-17T13:04:03+0000,2025-03-17T13:04:03+0000,ok
locales.es,madrid,venta,8,117674,venta:117674,https://www.locales.es/madrid/alquiler-venta/local117674?offerType=1&estateType=3&settlement=6773,https://www.locales.es/madrid/contactar/propietario/117674,"Local comercial en Venta en Calle de José de Cadalso, Sol, Madrid","Comercio en venta, alquiler con 163m² en Madrid, en la zona de Sol, Calle de José de Cadalso",Local comercial,local_comercial,De propietario,180000.0,1104.3,163.0,1.0,Patio | Persiana metálica | Aire acondicionado | Almacén | +2,"Local luminoso con 2 plantas, apto para cambio de uso, en zona residencial, requiere reforma.","Excelente local en buen estado de conservación en el Barrio de Águilas-Carabanchel. Necesita reforma y es apto para cambio de uso. Se encuentra disponible en venta o en alquiler. No dispone de salida de humos. Nos encontramos ante un luminoso local de 163 m2, distribuidos en 2 plantas; próximo a Renfe y metro, en zona residencial, que consta de los siguientes elementos: En planta calle encontramos 68 m² útiles, con una gran zona diáfana, ideal para adaptarlo a tus necesidades. El sótano cuenta con 68 m², distribuidos en dos amplias estancias y un cuarto de baño. El local dispone de suelo de gresite de alta calidad, puerta de seguridad, calefacción y aire acondicionado.",Sol,Madrid > Sol > Venta,"Calle de José de Cadalso, Sol, Madrid","Sol, Madrid, España",ok,nominatim,unknown,"Sol, Plaza de la Puerta del Sol, Barrio de los Austrias, Sol, Centro, Madrid, Comunidad de Madrid, 28013, España",40.4178272,-3.7022221,,,,,,,,2025-04-10T09:55:38+0000,2025-04-10T12:30:29+0000,ok
locales.es,madrid,venta,8,117831,venta:117831,https://www.locales.es/madrid/alquiler-venta/local117831?offerType=1&estateType=3&settlement=6773,https://www.locales.es/madrid/contactar/propietario/117831,"Local comercial en Venta en Avenida ciudad de barcelona, Pacífico, Madrid","Local comercial en venta, alquiler con 62m² en Madrid, en la zona de Pacífico, Avenida ciudad de barcelona, 21",Local comercial,local_comercial,De inmobiliaria,365000.0,5887.1,62.0,,Patio,"Local de 64 m² con gran visibilidad, cercano al metro y en área comercial con potencial alto de clientela.","!OPORTUNIDAD ÚNICA! LOCAL COMERCIAL EN LA AV. CIUDAD DE BARCELONA (BARRIO DE RETIRO, MADRID) Ubicado en uno de los tramos más estratégicos de la Avenida Ciudad de Barcelona, a escasos 50 metros del Metro Menéndez Pelayo y a 500 metros de la Puerta de Atocha. Este local cuenta con excelente visibilidad, gran paso peatonal y rodado, en una zona comercial y residencial rodeada de grandes marcas como Granier, Alain Afflelou, Mapfre y más. Características principales: Superficie total: 64 m2 construidos (51 m2 útiles) en planta calle. Extras: Patio privativo de 6,44 m2 útiles y sótano. Fachada acristalada: 4,5 metros lineales para máxima exposición. Ideal para hostelería: Zona sin restricciones (sin salida de humos). Para reformar: Adáptalo a tus necesidades. Precio Alquiler: 1.750 €/mes + IVA. Precio Venta: 365.000 € + IVA. Ventajas: Excelente conexión con transporte público. Zona consolidada con gran afluencia de clientes potenciales. Ideal para negocios que buscan proyección y tráfico constante. !No dejes pasar esta oportunidad de negocio! Contáctanos para más información: Este establecimiento es comercializado por InmoRest, referencia 1026. !Contáctanos hoy mismo para más detalles y comienza tu camino hacia el éxito empresarial en uno de los barrios más vibrantes de Madrid! 9 1 0 2 5 0 0 3 4 indicando la Referencia 1026 La información incluida no es vinculante y no forma parte de ninguna oferta o contrato y puede estar sujeta a cualquier modificación sin previo aviso. Somos expertos en locales de hostelería y podemos ayudarle a elegir la mejor ubicación para su negocio. Cualquier información puede consultarnos por WhatsApp al 9 1 0 2 5 0 0 3 4.",Pacífico,Madrid > Pacífico > Venta,"Avenida ciudad de barcelona, Pacífico, Madrid","Avenida ciudad de barcelona, Pacífico, Madrid, España",ok,nominatim,street_approx,"Avenida de la Ciudad de Barcelona, Pacífico, Retiro, Madrid, Comunidad de Madrid, 28007, España",40.4057412,-3.6858253,8a390ca35107fff,10.0,3002.0,3.0,Retiro,31.0,Pacífico,2025-04-14T09:11:56+0000,2025-04-14T09:12:10+0000,ok
locales.es,madrid,venta,8,122089,venta:122089,https://www.locales.es/madrid/venta/local122089?offerType=1&estateType=3&settlement=6773,https://www.locales.es/madrid/contactar/propietario/122089,"Local comercial en Venta en Calle de Jaén, Cuatro Caminos, Madrid","Local comercial en venta con 194m² en Madrid, en la zona de Cuatro Caminos, Calle de Jaén",Local comercial,local_comercial,De inmobiliaria,280000.0,1443.3,194.0,,Aire acondicionado | Almacén | Situado a pie de calle,"Espacio diáfano con tres estancias, dos aseos, almacén y cámara frigorífica en buen estado, ideal para oficinas o estudio.","MVB-3985. Descubre este amplio local en Berruguete, distrito de Tetuán. Con una superficie de 194 m², este espacio diáfano ofrece múltiples posibilidades para adaptarse a sus necesidades. Dispone de tres estancias, dos aseos y un baño privado, lo que lo convierte en una opción ideal para oficinas, trasteros, estudios o incluso un loft. Su ubicación a pie de calle garantiza una excelente visibilidad y acceso.El local se encuentra en buen estado y cuenta con un almacén y cámara frigorífica, lo que añade funcionalidad a este atractivo espacio. No pierdas la oportunidad y ven a visitar este local, perfecto para tu negocio o proyecto personal..",Cuatro Caminos,Madrid > Cuatro Caminos > Venta,"Calle de Jaén, Cuatro Caminos, Madrid","Calle de Jaén, Cuatro Caminos, Madrid, España",ok,nominatim,street_approx,"Calle de Jaén, Cuatro Caminos, Tetuán, Madrid, Comunidad de Madrid, 28020, España",40.4503901,-3.700868,8a390cb199affff,10.0,6035.0,6.0,Tetuán,62.0,Cuatro Caminos,2025-05-07T09:33:05+0000,2025-05-07T09:33:05+0000,ok
locales.es,madrid,venta,8,123812,venta:123812,https://www.locales.es/madrid/venta/local123812?offerType=1&estateType=3&settlement=6773,https://www.locales.es/madrid/contactar/propietario/123812,"Local comercial en Venta en Ventas, Madrid","Restaurante en venta con 83m² en Madrid, en la zona de Ventas",Local comercial,local_comercial,De inmobiliaria,280000.0,,83.0,2.0,Cocina completamente equipada | Almacén | Salida de humos | Luminoso,"Local con 2 estancias, 2 baños, cocina con salida de humos en zona comercial cerca de transporte y servicios públicos.","!Increíble oportunidad de adquirir un local comercial en una de las zonas más demandadas de Madrid, Ciudad Lineal - Ventas! Este local cuenta con 2 estancias, una en planta calle y otra en sótano, 2 baños y está en excelente estado de segunda mano. Con una ubicación privilegiada cerca de zonas comerciales, parques públicos, restaurantes, bancos y transporte público, este local es perfecto para emprender tu negocio. Además, su cocina independiente con salida de humos, lo convierten en un espacio versátil y funcional. No dejes pasar esta oportunidad de inversión en una ubicación inmejorable. !Contáctanos para más información! licencia de bar restaurante, al lado aparcamientos y polideportivo y gimnasio Los Nogales.",Ventas,Madrid > Ventas > Venta,"Ventas, Madrid","Ventas, Madrid, España",ok,nominatim,unknown,"Ventas, Calle de Julio Camba, Guindalera, Salamanca, Madrid, Comunidad de Madrid, 28028, España",40.4310642,-3.6635419,,,,,,,,2025-05-23T07:40:45+0000,2025-05-23T07:40:48+0000,ok
locales.es,madrid,venta,8,125395,venta:125395,https://www.locales.es/madrid/venta/local125395?offerType=1&estateType=3&settlement=6773,https://www.locales.es/madrid/contactar/propietario/125395,"Local comercial en Venta en Calle de Orense, Cuatro Caminos, Madrid","Local comercial en venta con 110m² en Madrid, en la zona de Cuatro Caminos, Calle de Orense",Local comercial,local_comercial,De inmobiliaria,350000.0,3181.8,110.0,1.0,Recepción | Escaparate | Luminoso,"Local en planta baja con 3 despachos, recepción y 2 aseos, ubicado en zona en renovación urbana del Proyecto RenAZCA.","AJ-02968. Look and Find Castellana presenta este amplio local de 110m2 situado en una de las zonas más destacadas de la capital, en el corazón del distrito financiero de AZCA, a dos pasos del Corte Ingles de la castellana.~Ubicado en una sola planta, el espacio cuenta con un amplio escaparate, ideal para dar visibilidad a tu negocio. En su interior encontrarás una zona de recepción, tres despachos individuales separados por mamparas con ventanas que aportan luz natural, y dos aseos. Además, dispone de cierre de seguridad para mayor tranquilidad.~El local tiene una distribución versátil que puede adaptarse fácilmente a diferentes tipos de actividad profesional o comercial.~ Ubicación privilegiada en el entorno del Proyecto RenAZCA~Este local se encuentra dentro del área del Proyecto RenAZCA, un plan de transformación urbana que renovará completamente la zona de AZCA. El objetivo es convertir este espacio en un entorno más moderno, verde, seguro y cómodo, con nuevas zonas peatonales, jardines, mejor iluminación y servicios. Gracias a esta renovación, la zona está ganando valor y atractivo para empresas, profesionales y comercios, lo que convierte este local en una gran oportunidad de futuro. No dejes pasar esta ocasión de establecer tu negocio en uno de los puntos más estratégicos y con mayor proyección de Madrid.~.",Cuatro Caminos,Madrid > Cuatro Caminos > Venta,"Calle de Orense, Cuatro Caminos, Madrid","Calle de Orense, Cuatro Caminos, Madrid, España",ok,nominatim,street_approx,"Calle de Orense, Cuatro Caminos, Tetuán, Madrid, Comunidad de Madrid, 28020, España",40.4557549,-3.6946881,8a390cb0a587fff,10.0,6048.0,6.0,Tetuán,62.0,Cuatro Caminos,2025-06-05T14:38:25+0000,2025-06-05T14:38:25+0000,ok
