source_portal,city_slug,operation,page_number,listing_id,listing_key,listing_url,contact_url,card_title,detail_title,product_name,listing_type,advertiser_type,price_eur,price_per_m2_eur,area_m2,bathroom_count,tag_list,description_short,description_full,breadcrumb_zone,breadcrumb_path,address_text,geocode_query,geocode_status,coord_source,coord_precision,geocode_display_name,lat_wgs84,lon_wgs84,h3_cell,h3_resolution,section_key,district_code,district_name,barrio_code,barrio_name,published_at,modified_at,detail_fetch_status
locales.es,madrid,venta,12,49908,venta:49908,https://www.locales.es/madrid/venta/local49908?offerType=1&estateType=3&settlement=6773,https://www.locales.es/madrid/contactar/propietario/49908,"Local comercial en Venta en calle de bravo murillo, Cuatro Caminos, Madrid","Local comercial en venta con 413m² en Madrid, en la zona de Cuatro Caminos, calle de bravo murillo, 28020",Local comercial,local_comercial,De inmobiliaria,1030000.0,2493.9,413.0,2.0,Aire acondicionado,"Local de 422m², esquina, 2 plantas, ideal para negocios en zona Tetuán, Madrid.","MVB-V1855. OPORTUNIDAD!!! Amplio local de 422 m2 en calle muy comercial de Bravo Murillo, zona de Tetuán a pocos pasos de la calle de Sor Angela de la Cruz y de Marques de Viana. Hace esquina y cuenta con amplia fachada, . El local se divide en dos plantas:• La planta calle tiene 270m2 y se distribuye en una zona diáfana con acceso al portal.• La planta sótano se divide en una amplia zona diáfana que en la actualidad está compartimentada en 2 despachos. La última actividad fue una tienda de deportes.Ideal para todo tipo de negocio al encontrarse en una zona muy comercial. Compra con la cabeza, vende con el corazónEncuentra más en .",Cuatro Caminos,Madrid > Cuatro Caminos > Venta,"calle de bravo murillo, Cuatro Caminos, Madrid","calle de bravo murillo, Cuatro Caminos, Madrid, España",ok,nominatim,street_approx,"Calle de Bravo Murillo, Cuatro Caminos, Tetuán, Madrid, Comunidad de Madrid, 28039, España",40.4522614,-3.7031776,8a390cb1d64ffff,10.0,6018.0,6.0,Tetuán,61.0,Bellas Vistas,2024-11-13T17:20:15+0000,2025-02-10T17:06:13+0000,ok
locales.es,madrid,venta,12,50001,venta:50001,https://www.locales.es/madrid/venta/local50001?offerType=1&estateType=3&settlement=6773,https://www.locales.es/madrid/contactar/propietario/50001,"Local comercial en Venta en calle alaro, Timón, Madrid","Local comercial en venta con 85m² en Madrid, en la zona de Timón, calle alaro, 28042",Local comercial,local_comercial,De inmobiliaria,262100.0,3083.5,85.0,2.0,,Dos locales de 76m² y 88m² disponibles. Ideal para inversión.,AT-00229060. Investment Group10 vende 2 locales situados en Madrid capital. Tienen una superficie de 76 m2 y 88 m2 respectivamente.Contacta con nosotros en el 617.60. 27.81 - 622.76. 36.06 - 825.933. 675..,Timón,Madrid > Timón > Venta,"calle alaro, Timón, Madrid","calle alaro, Timón, Madrid, España",ok,nominatim,street_approx,"Calle de Alaró, Timón, Barajas, Madrid, Comunidad de Madrid, 28042, España",40.4713046,-3.5825251,8a390cb5159ffff,10.0,21026.0,21.0,Barajas,214.0,Timón,2024-11-13T17:20:28+0000,2025-02-10T17:06:12+0000,ok
locales.es,madrid,venta,12,50003,venta:50003,https://www.locales.es/madrid/venta/local50003?offerType=1&estateType=3&settlement=6773,https://www.locales.es/madrid/contactar/propietario/50003,"Local comercial en Venta en calle alejandrina moran, Lucero, Madrid","Local comercial en venta con 551m² en Madrid, en la zona de Lucero, calle alejandrina moran, 28047",Local comercial,local_comercial,De inmobiliaria,420000.0,762.3,551.0,2.0,Situado a pie de calle,"Local comercial de 551m² con planta baja y sótano, distribución flexible y múltiples salas.","AT-00229022. Investment Group10 vende un local comercial en el barrio de Lucero con amplias posibilidades. La planta baja tiene 281 m2 útiles y la planta sótano 270 m2.El local consta de un hall situado a pie de calle, que da acceso a entreplanta y sótano. Entreplanta con pasillo distribuidor,8 salas de diferentes tamaños y 2 aseos. Sótano compuesto de 3 habitaciones. Suelos de gres. Longitud de fachada de 8,5 metros.Contacta con nosotros en el 617.60. 27.81 - 622.76. 36.06 - 825.933. 675..",Lucero,Madrid > Lucero > Venta,"calle alejandrina moran, Lucero, Madrid","calle alejandrina moran, Lucero, Madrid, España",ok,nominatim,street_approx,"Calle de Alejandrina Morán, Lucero, Latina, Madrid, Comunidad de Madrid, 28047, España",40.4023275,-3.747003,8a390cba9987fff,10.0,10058.0,10.0,Latina,103.0,Lucero,2024-11-13T17:20:28+0000,2025-02-10T17:06:12+0000,ok
locales.es,madrid,venta,12,50042,venta:50042,https://www.locales.es/madrid/venta/local50042?offerType=1&estateType=3&settlement=6773,https://www.locales.es/madrid/contactar/propietario/50042,"Local comercial en Venta en calle de rosario romero, Almenara, Madrid","Local comercial en venta con 160m² en Madrid, en la zona de Almenara, calle de rosario romero, 28029",Local comercial,local_comercial,De inmobiliaria,390000.0,2437.5,160.0,3.0,Cocina completamente equipada | Aire acondicionado | Almacén | Muebles | +2,"Local de 155m² dúplex reformado, con cocina, aire acondicionado y acceso PMR, cerca del metro Ventilla.","LOCAL VENTILLA. Este local se encuentra en Calle de Rosario Romero, 28029, Madrid, en la zona del Ventilla_Almenara, en la planta baja. Está construido en el año 2004 y reformado en 2008. Consta de 155 m2.Se trata de un local muy luminoso con orientación este. Consta de dos estancias:1. Planta baja (suelo de tarima, entrada desde la calle, pintura lisa, amueblada, buen estado, calefacción individual: bomba de frío y calor, almacén, aire acondicionado, internet, escaleras, exterior, luminosa, aseo, cocina equipada, dúplex, reformada y acceso a personas con movilidad reducida).2. Planta alta (suelo de tarima, sala de reuniones, despacho, aire acondicionado, internet, luminosa, aseo, dúplex, reformada).Este maravilloso local se encuentra a escasos minutos del metro de Ventilla.¡Mejor ver!Un experto en tu zona valora tu vivienda gratuitamente ¡Contacta!Construyendo tu mundo de confianzaEncuentra más en .",Almenara,Madrid > Almenara > Venta,"calle de rosario romero, Almenara, Madrid","calle de rosario romero, Almenara, Madrid, España",ok,nominatim,street_approx,"Calle de Rosario Romero, Almenara, Tetuán, Madrid, Comunidad de Madrid, 28029, España",40.4695545,-3.6980248,8a390cb0e68ffff,10.0,6073.0,6.0,Tetuán,64.0,Almenara,2024-11-13T17:20:33+0000,2025-02-10T17:06:11+0000,ok
locales.es,madrid,venta,12,51478,venta:51478,https://www.locales.es/madrid/venta/local51478?offerType=1&estateType=3&settlement=6773,https://www.locales.es/madrid/contactar/propietario/51478,"Local comercial en Venta en Calle de Felipe IV, Jerónimos, Madrid","Local comercial en venta con 160m² en Madrid, en la zona de Jerónimos, Calle de Felipe IV",Local comercial,local_comercial,De inmobiliaria,1500000.0,9375.0,160.0,2.0,Sistemas de Seguridad | Aire acondicionado,Local de 160m² cerca del Retiro y Museo del Prado. Edificio histórico y bien comunicado.,"M-35-00024-O. Local comercial representativo en Jerónimos, cerca del parque del Retiro, muy próximo a focos de atracción turística. Ubicado en un edificio protegido con catalogación parcial del conjunto Histórico de la Villa de Madrid. Muy bien comunicado con líneas de bus y de metro muy cercanas. A 5 minutos andando del Museo Nacional del Prado. Baños divididos por géneros. Suelos de mármol en la estancia de la entrada..",Jerónimos,Madrid > Jerónimos > Venta,"Calle de Felipe IV, Jerónimos, Madrid","Calle de Felipe IV, Jerónimos, Madrid, España",ok,nominatim,street_approx,"Calle de Felipe IV, Jerónimos, Retiro, Madrid, Comunidad de Madrid, 28014, España",40.4154315,-3.6896438,8a390cb1b2d7fff,10.0,3069.0,3.0,Retiro,35.0,Jerónimos,2024-11-13T17:23:47+0000,2024-11-13T17:23:47+0000,ok
locales.es,madrid,venta,12,51553,venta:51553,https://www.locales.es/madrid/venta/local51553?offerType=1&estateType=3&settlement=6773,https://www.locales.es/madrid/contactar/propietario/51553,"Local comercial en Venta en calle de alberto aguilera, Arapiles, Madrid","Local comercial en venta con 385m² en Madrid, en la zona de Arapiles, calle de alberto aguilera, 28015",Local comercial,local_comercial,De inmobiliaria,825000.0,2142.9,385.0,4.0,Aire acondicionado | Escaparate,"Local comercial de 385m², ideal para negocios. Próximo a metro San Bernardo.","LOCALALBERTOAGUILERA. MUNDHOGAR CONSULTING ofrece este fantástico local comercial en el centro de Madrid a 3 minutos andando de la estación de metro San Bernardo. Está distribuido en una planta baja de 200 metros cuadrados, diáfana, con dos aseos y una planta sótano de 180 metros cuadrados con 2 aseos.Local con máxima exposición en una zona céntrica muy transitada ¡¡¡¡ UBICACIÓN INMEJORABLE !!!!Se encuentra en perfecto estado, dispone de:CalefacciónAire acondicionadoSistema de alarmaPuerta de seguridadFACHADA DE ESCAPARATE DE CRISTAL DE 18 METROS LINEALES haciendo esquina (una de 5 metros y otra de 13 metros)OPORTUNIDAD INMEJORABLE PARA NEGOCIOS,También se encuentra disponible para alquiler, consultar.¡¡¡¡ MEJOR VER !!!!Mundhogar ConsultingConstruyendo tu mundo de confianza.",Arapiles,Madrid > Arapiles > Venta,"calle de alberto aguilera, Arapiles, Madrid","calle de alberto aguilera, Arapiles, Madrid, España",ok,nominatim,street_approx,"Calle de Alberto Aguilera, Malasaña, Arapiles, Chamberí, Centro, Madrid, Comunidad de Madrid, 28015, España",40.4297116,-3.7075355,8a390cb1b827fff,10.0,1103.0,1.0,Centro,15.0,Universidad,2024-11-13T17:23:58+0000,2025-02-10T17:05:58+0000,ok
locales.es,madrid,venta,12,51770,venta:51770,https://www.locales.es/madrid/venta/local51770?offerType=1&estateType=3&settlement=6773,https://www.locales.es/madrid/contactar/propietario/51770,"Local comercial en Venta en calle de la isla de arosa, Peñagrande, Madrid","Local comercial en venta con 147m² en Madrid, en la zona de Peñagrande, calle de la isla de arosa, 28035",Local comercial,local_comercial,De inmobiliaria,199000.0,1353.7,147.0,,,"Local de 147 m² con usos variados en zona residencial, planta baja y sótano.","60476979. MUNDHOGAR CONSULTING ofrece fantástico local en la zona de Barrio del Pilar, a 4 minutos andando de la estación de metro de Avenida de la Ilustración y próximo al Centro Comercial La Vaguada.Local de 147 m² distribuidos en planta baja y en sótano, este último accesible a través de una escalera interior.Se encuentra situado en zona residencial con gran variedad de comercios y rodeado de zonas verdes.Tiene opción de cambio de uso. ¡MEJOR VER!Mundhogar Consulting.Tu lugar en el mundo..",Peñagrande,Madrid > Peñagrande > Venta,"calle de la isla de arosa, Peñagrande, Madrid","calle de la isla de arosa, Peñagrande, Madrid, España",ok,nominatim,street_approx,"Calle de la Isla de Arosa, Peñagrande, Fuencarral-El Pardo, Madrid, Comunidad de Madrid, 28035, España",40.480843,-3.7163364,8a390cb0eca7fff,10.0,8029.0,8.0,Fuencarral - El Pardo,83.0,Peñagrande,2024-11-13T17:24:28+0000,2025-02-10T17:05:57+0000,ok
locales.es,madrid,venta,12,52123,venta:52123,https://www.locales.es/madrid/venta/local52123?offerType=1&estateType=3&settlement=6773,https://www.locales.es/madrid/contactar/propietario/52123,"Local comercial en Venta en Calle de Toledo, Acacias, Madrid","Bar en venta con 41m² en Madrid, en la zona de Acacias, Calle de Toledo",Local comercial,local_comercial,De inmobiliaria,275000.0,6707.3,41.0,2.0,Muebles,Bar con licencia ubicado frente al metro y Renfe de Pirámides.,"OP-021121.01. SIN COMISIÓN DE AGENCIA CONSORCIO REAL ESTATE OPERA VENDE. TELÉFONO/WASAP: +34 646 92 66 76. Bar Cafeteria con licencia frente al metro y Renfe de Piramides.~ ~ La glorieta de las Pirámides constituye el acceso este al puente de Toledo de Madrid, uno de los puentes históricos que salva el río Manzanares. Denominada inicialmente glorieta del Puente de Toledo, recibió su nombre de dos obeliscos construidos por Francisco Javier de Marietegui y erigidos en la plaza en 183112 (otras fuentes hablan de 1830).3 Actualmente, confluyen en la glorieta la calle de Toledo (antiguo Paseo de los Ocho Hilos), el paseo de Yeserías (que corre paralelo al río Manzanares, hacia el sur), el Paseo Imperial, el paseo de las Acacias (vía natural desde Atocha pasando por Acacias) y calle de Alejandro Dumas (anteriormente calle de las Cambroneras) que discurre inicialmente paralela al río Manzanares hacia al norte, y de la cual sale poco después, a la izquierda, el paseo de los Melancólicos. El Puente de Toledo conecta la glorieta con la del Marqués de Vadillo, al otro lado del Manzanares..",Acacias,Madrid > Acacias > Venta,"Calle de Toledo, Acacias, Madrid","Calle de Toledo, Acacias, Madrid, España",ok,nominatim,street_approx,"Calle de Toledo, Las Acacias, Arganzuela, Madrid, Comunidad de Madrid, 28005, España",40.4028478,-3.7133213,8a390ca3412ffff,10.0,2087.0,2.0,Arganzuela,22.0,Acacias,2024-11-13T17:25:18+0000,2024-11-13T17:25:18+0000,ok
locales.es,madrid,venta,12,52124,venta:52124,https://www.locales.es/madrid/venta/local52124?offerType=1&estateType=3&settlement=6773,https://www.locales.es/madrid/contactar/propietario/52124,"Local comercial en Venta en Plaza de Ortega y Murillo, Acacias, Madrid","Bar en venta con 41m² en Madrid, en la zona de Acacias, Plaza de Ortega y Murillo",Local comercial,local_comercial,De inmobiliaria,275000.0,6707.3,41.0,2.0,Muebles,"Bar cafetería con licencia, ubicación céntrica cerca del metro y Renfe, en zona histórica de Madrid.","OP-021121.01.2. SIN COMISIÓN DE AGENCIA CONSORCIO REAL ESTATE OPERA VENDE. TELÉFONO/WASAP: +34 646 92 66 76. Bar Cafeteria con licencia frente al metro y Renfe de Piramides.~ ~ La glorieta de las Pirámides constituye el acceso este al puente de Toledo de Madrid, uno de los puentes históricos que salva el río Manzanares. Denominada inicialmente glorieta del Puente de Toledo, recibió su nombre de dos obeliscos construidos por Francisco Javier de Marietegui y erigidos en la plaza en 18311​2​ (otras fuentes hablan de 1830).3​ Actualmente, confluyen en la glorieta la calle de Toledo (antiguo Paseo de los Ocho Hilos), el paseo de Yeserías (que corre paralelo al río Manzanares, hacia el sur), el Paseo Imperial, el paseo de las Acacias (vía natural desde Atocha pasando por Acacias) y calle de Alejandro Dumas (anteriormente calle de las Cambroneras) que discurre inicialmente paralela al río Manzanares hacia al norte, y de la cual sale poco después, a la izquierda, el paseo de los Melancólicos. El Puente de Toledo conecta la glorieta con la del Marqués de Vadillo, al otro lado del Manzanares..",Acacias,Madrid > Acacias > Venta,"Plaza de Ortega y Murillo, Acacias, Madrid","Acacias, Madrid, España",ok,nominatim,unknown,"Acacias, Paseo de las Acacias, Las Acacias, Arganzuela, Madrid, Comunidad de Madrid, 28005, España",40.4040749,-3.7059572,,,,,,,,2024-11-13T17:25:18+0000,2024-11-13T17:25:18+0000,ok
locales.es,madrid,venta,12,52166,venta:52166,https://www.locales.es/madrid/venta/local52166?offerType=1&estateType=3&settlement=6773,https://www.locales.es/madrid/contactar/propietario/52166,"Local comercial en Venta en calle de ramón gómez de la serna, Peñagrande, Madrid","Local comercial en venta con 151m² en Madrid, en la zona de Peñagrande, calle de ramón gómez de la serna, 28035",Local comercial,local_comercial,De inmobiliaria,330000.0,2185.4,151.0,,Aire acondicionado,"Local nuevo con amplia planta baja y sótano, baños, aire acondicionado, ideal para negocios en área de alto tránsito.","60532472. MUNDHOGAR CONSULTING ofrece este fantástico local comercial procedente de banco, distribuido en una amplia planta baja y una planta sótano.Dispone de baños aire acondicionado y ventilación.La planta baja tiene un amplio escaparate.Se encuentra como nuevo y con muy buenas calidades. Es perfecto para poner cualquier tipo de negocio ya que se encuentra en muy buena zona, con mucho transito y está muy bien comunicado. ¡¡MEJOR VER¡¡Mundhogar ConsultingTu lugar en el mundo.",Peñagrande,Madrid > Peñagrande > Venta,"calle de ramón gómez de la serna, Peñagrande, Madrid","calle de ramón gómez de la serna, Peñagrande, Madrid, España",ok,nominatim,street_approx,"Calle de Ramón Gómez de la Serna, Peñagrande, Fuencarral-El Pardo, Madrid, Comunidad de Madrid, 28035, España",40.4827146,-3.7250764,8a390cb03a17fff,10.0,8151.0,8.0,Fuencarral - El Pardo,83.0,Peñagrande,2024-11-13T17:25:24+0000,2025-02-10T17:05:55+0000,ok
locales.es,madrid,venta,12,52170,venta:52170,https://www.locales.es/madrid/venta/local52170?offerType=1&estateType=3&settlement=6773,https://www.locales.es/madrid/contactar/propietario/52170,"Local comercial en Venta en calle de clara del rey, Prosperidad, Madrid","Local comercial en venta con 1195m² en Madrid, en la zona de Prosperidad, calle de clara del rey, 28002",Local comercial,local_comercial,De inmobiliaria,1445000.0,1209.2,1195.0,3.0,Patio | Cocina completamente equipada | Almacén | Ascensor | +1,"Local de 1.195 m2 con 13 despachos, sala VIP, almacenes, climatización. Ideal para oficinas. Excelente ubicación.","BABI-00130. Investment Group10 vende estupendo local de 1.195 m2 formado por 5 unidades registrales de oficinas en planta baja y sótano. Las 5 unidades tienen forma similar y están iluminadas en sus lados longitudinales a patio interior. Actualmente están conectadas física y funcionalmente, e interconectadas por escaleras y ascensor. Distribución: 13 despachos, 3 baños, 4 almacenes, 1 sala de formación, 1 cocina, 1 sala VIP y zona de recepción. El cuerpo principal de la planta de distribución está unido a la entrada del residencial de Clara del Rey 52 por un ascensor y escaleras interiores. Perfecto estado de uso, totalmente operativo. El local dota de una altura libre de 2,56m2, falso techo, climatización, 2 salidas de emergencia y una fachada de 3m2, dispone de oficinas con luz natural desde la planta semisótano hasta la primera planta. Anteriormente funcionaba como centro médico privado. Los inmuebles están situados en el distrito de Chamartín, el entorno urbano está consolidado con usos residenciales y terciarios. La zona está bien comunicada con el centro de la ciudad y con la M-30.Si necesita mas información no dude en llamarnos al: 617.60. 27.81 // 825.93. 36.75 ¡ESTAREMOS ENCANTADOS DE ATENDERL@S! (También atendemos vía WhatsApp)..",Prosperidad,Madrid > Prosperidad > Venta,"calle de clara del rey, Prosperidad, Madrid","calle de clara del rey, Prosperidad, Madrid, España",ok,nominatim,street_approx,"Calle de Clara del Rey, Prosperidad, Chamartín, Madrid, Comunidad de Madrid, 28002, España",40.4477843,-3.6676303,8a390ca2411ffff,10.0,5022.0,5.0,Chamartín,52.0,Prosperidad,2024-11-13T17:25:25+0000,2025-02-10T17:05:54+0000,ok
locales.es,madrid,venta,12,52206,venta:52206,https://www.locales.es/madrid/venta/local52206?offerType=1&estateType=3&settlement=6773,https://www.locales.es/madrid/contactar/propietario/52206,"Local comercial en Venta en calle de arturo soria, San Juan Bautista, Madrid","Local comercial en venta con 209m² en Madrid, en la zona de San Juan Bautista, calle de arturo soria, 28033",Local comercial,local_comercial,De inmobiliaria,290000.0,1387.6,209.0,3.0,Escaparate | Situado a pie de calle,"Local de 209m² cerca de Pinar de Chamartín, distribuido en tres niveles y con gran luminosidad. A reformar.","60442364. MUNDHOGAR CONSULTING ofrece fantástico local de 209 m² en Arturo Soria, a 2 minutos andando de la estación de tren de Pinar de Chamartín. Situado a pie de calle en zona residencial; se distribuye en planta baja, alta y sótano, a las que se acceden a través de unas escaleras. A reformar, consta de 3 estancias y 3 aseos independientes.Fachada amplia y escaparate con grandes ventanales que aportan gran luminosidad al local.Inmejorable oportunidad de negocio.¡MEJOR VER!Mundhogar Consulting.Tu lugar en el mundo..",San Juan Bautista,Madrid > San Juan Bautista > Venta,"calle de arturo soria, San Juan Bautista, Madrid","calle de arturo soria, San Juan Bautista, Madrid, España",ok,nominatim,street_approx,"Calle de Arturo Soria, San Juan Bautista, Ciudad Lineal, Madrid, Comunidad de Madrid, 28043, España",40.4534258,-3.654426,8a390ca24a47fff,10.0,15151.0,15.0,Ciudad Lineal,156.0,San Juan Bautista,2024-11-13T17:25:30+0000,2025-02-10T17:05:54+0000,ok
locales.es,madrid,venta,12,52207,venta:52207,https://www.locales.es/madrid/venta/local52207?offerType=1&estateType=3&settlement=6773,https://www.locales.es/madrid/contactar/propietario/52207,"Local comercial en Venta en calle de antonio ponz, Pueblo Nuevo, Madrid","Local comercial en venta con 180m² en Madrid, en la zona de Pueblo Nuevo, calle de antonio ponz, 28017",Local comercial,local_comercial,De inmobiliaria,110400.0,613.3,180.0,2.0,Situado a pie de calle | Luminoso,"Local exterior, luminoso, con planta baja y sótano, entre metro Ascao y Elipa.","ANTONIOPONZ. MUNDHOGAR CONSULTING ofrece este fantástico local de banco de 180 m², a reformar, situado en el distrito de Pueblo Nuevo, entre las estaciones de metro de Ascao (linea 7) y la Elipa (linea 2).Local exterior, a pie de calle y muy luminoso, con amplios ventanales.Consta de planta baja y sótano, al que se accede a través de unas escaleras; también cuenta con dos aseos independientes.Se ubica en zona residencial con gran oportunidad de negocio.¡¡¡ MEJOR VER !!!Mundhogar ConsultingTu lugar en el mundo.",Pueblo Nuevo,Madrid > Pueblo Nuevo > Venta,"calle de antonio ponz, Pueblo Nuevo, Madrid","calle de antonio ponz, Pueblo Nuevo, Madrid, España",ok,nominatim,street_approx,"Calle de Antonio Ponz, Pueblo Nuevo, Ciudad Lineal, Madrid, Comunidad de Madrid, 28017, España",40.428268,-3.6439446,8a390ca20057fff,10.0,15053.0,15.0,Ciudad Lineal,152.0,Pueblo Nuevo,2024-11-13T17:25:30+0000,2025-02-10T17:05:54+0000,ok
locales.es,madrid,venta,12,52260,venta:52260,https://www.locales.es/madrid/venta/local52260?offerType=1&estateType=3&settlement=6773,https://www.locales.es/madrid/contactar/propietario/52260,"Local comercial en Venta en calle de bailén, Palacio, Madrid","Local comercial en venta con 112m² en Madrid, en la zona de Palacio, calle de bailén, 28005",Local comercial,local_comercial,De inmobiliaria,465000.0,4151.8,112.0,2.0,,"Local en venta, bien comunicado. Ideal inversión.","SBRE-0180909. Investment Group10 vende local comercial ubicado en la localidad de Madrid, provincia de Madrid. Dispone de buenos accesos y está bien comunicada. Oportunidad única de adquirir este local comercial en una de las mejores zonas de Madrid. Aprovecha las múltiples posibilidades de distribución, adecuación y reforma para configurar tu nuevo negocio en el local que te ofrecemos. Además, por su gran tránsito comercial, visibilidad desde la vía pública y cómodos accesos, lo convierten en perfecto e inigualable en la zona. Se trata de un local en estado de reforma iniciada, repartido en dos plantas, las cuales se comunican por escalera interior. Tiene muchísimas posibilidades debido a su distribución y espacio. Es muy amplio y lo mejor de todo, su ubicación. Se encuentra en el distrito de Centro. Se pueden encontrar en los alrededores: el Palacio Real de Madrid, la Catedral de la Almudena y múltiples puntos de interés. Su situación ofrece conexiones con otras calles y avenidas clave de la ciudad. También cuenta con estaciones de metro cercanas, como la estación de Ópera y la estación de Santo Domingo, lo que facilita el acceso en transporte público. Por lo tanto, el local comercial tiene cercanos todos los servicios, equipamientos y atractivos necesarios para una gran afluencia de clientes. Empieza ya tu idea de emprendimiento. No lo dudes, invertir en el local que te ofrecemos será una apuesta segura.Si necesita mas información no dude en llamarnos al: 617.60. 27.81 // 825.93. 36.75 ¡ESTAREMOS ENCANTADOS DE ATENDERL@S! (También atendemos vía WhatsApp)..",Palacio,Madrid > Palacio > Venta,"calle de bailén, Palacio, Madrid","calle de bailén, Palacio, Madrid, España",ok,nominatim,unknown,"Senado de España, 3, Calle de Bailén, Palacio, Centro, Madrid, Comunidad de Madrid, 28071, España",40.4211638,-3.7117889,,,,,,,,2024-11-13T17:25:36+0000,2025-02-10T17:05:53+0000,ok
